;"berufliche Kompetenzen";"Beschreibung";"Quelle Curriculum"
"K1";"Kann grundlegende chemische/produktionstechnische Prozesse (unter Anwendung von ökologisch und ökonomisch orientierten Managementsystemen, sowie des Arbeitsschutzes und Sicherheitsmanagement) analysieren, planen, entwickeln  und dokumentieren";;"L4, L2, L1"
"K2";"Kann Umweltauswirkungen der Produkt- und Prozessplanung    ermitteln und zur internen externen Information dokumentieren, und Umweltmanagementsysteme anwenden ";;"L7"
"K3";"Kann grundlegende chemische/produktionstechnische Prozesse dimensionieren ";;"L2"
"K4";"Kann die Qualität der geplanten Produktionsprozesse bezüglich des Realisierungsprozess unter Beachtung der grundlegende Gesetze, Normen, Vorschriften und Regelungen bewerten  ";;"L1"
"K5";" Kann adäquate Geräte, Messsysteme, Apparate und Maschinen auswählen ";;"L2"
"K6";" Kann die (Planungs-)Ergebnisse dokumentieren und darstellen und begründen ";;"L1, L2"
"K7";"Kann grundlegende geplanten/ entwickelten chemische/produktionstechnische Prozesse durchführen ";;"L2"
"K8";" Kann Wege zur Erstellung von chemischen, biologischen und pharmazeutischen Stoffen analysieren, bewerten,entwickeln und durchführen ";;"L6-SP: Labortechnik, 
L5-SP: Labortechnik"
"K9";"Kann Synthese- Produktionsverfahren projektieren, realisieren und validieren";;"L6"
